{
  "queryId": "018f22e2-7c15-7b2e-8d86-2de956a9d420",
  "queryType": "artifact.get_effective_binding",
  "queryVersion": "1.0",
  "scopeRef": {
    "enterpriseId": "018f22e2-7c15-7b2e-8d86-2de956a9d201",
    "projectId": "018f22e2-7c15-7b2e-8d86-2de956a9d302"
  },
  "requester": {
    "kind": "OBJECT",
    "objectType": "identity.principal",
    "objectId": "018f22e2-7c15-7b2e-8d86-2de956a9d203",
    "scope": {
      "enterpriseId": "018f22e2-7c15-7b2e-8d86-2de956a9d201"
    }
  },
  "authenticationContextRef": {
    "kind": "CONTENT_ADDRESSED",
    "objectType": "identity.authentication_context",
    "objectId": "018f22e2-7c15-7b2e-8d86-2de956a9d303",
    "scope": {
      "enterpriseId": "018f22e2-7c15-7b2e-8d86-2de956a9d201"
    },
    "contentHash": {
      "algorithm": "SHA-256",
      "digest": "4444444444444444444444444444444444444444444444444444444444444444",
      "canonicalizationVersion": "1"
    }
  },
  "consistencyRequirement": "AUTHORITATIVE",
  "correlationId": "018f22e2-7c15-7b2e-8d86-2de956a9d421",
  "requestedAt": "2026-08-17T00:00:00Z",
  "payload": {
    "artifactRef": {
      "kind": "OBJECT",
      "objectType": "artifact.artifact",
      "objectId": "018f22e2-7c15-7b2e-8d86-2de956a9d401",
      "scope": {
        "enterpriseId": "018f22e2-7c15-7b2e-8d86-2de956a9d201",
        "projectId": "018f22e2-7c15-7b2e-8d86-2de956a9d302"
      }
    },
    "purpose": "customer.delivery",
    "asOf": "2026-08-17T00:00:00Z"
  }
}
